email,type
"Subject: Strategies for Enhancing Digital Brand Growth

I hope this message finds you well You can reach me at [EMAIL].. I am interested in learning about effective digital strategies that can help boost brand growth and engagement for businesses. Could you share some insights or recommendations on this matter? Your input would be greatly appreciated. My name is [FULL_NAME].",Request
"Subject: Support for QuickBooks

I am seeking information on billing options and the integration of the QuickBooks Online SaaS platform. Could you provide details on the available plans and pricing? I would appreciate it if you could explain the benefits of each plan and how they cater to different business needs You can reach me at [EMAIL].. Additionally, I would like to know if there are any discounts available for long-term commitments and if a free trial period is offered. Please let me know the necessary information to assist with my inquiry. My name is [FULL_NAME].",Request
"Subject: Support Required

Dear Customer Support, I am writing to report an issue with the data visualization dashboard. The dashboard is not loading, and I suspect it might be due to an outdated browser version You can reach me at [EMAIL].. I have already tried restarting my browser and clearing the cache, but the problem still persists My name is [FULL_NAME].. I would greatly appreciate your assistance in resolving this matter. Please let me know if there are any additional steps I can take or if you require more information from me. I am available to provide further details if needed. Thank you for your time and support. I look forward to hearing from you soon. Sincerely, [Your Name]",Incident
"Subject: Concerns with Data Analytics

The data analytics tool is yielding inconsistent results My name is [FULL_NAME].. It appears recent software updates might be the cause of data input errors You can reach me at [EMAIL].. Efforts to revert to previous versions and validate input data have been unsuccessful.",Incident
"Subject: 

Dear Customer Support, the critical data analytics report generation has failed due to software compatibility issues arising from recent updates My name is [FULL_NAME].. I have attempted to reinstall the affected software and restart the systems, but the issue still persists. I urgently need assistance to resolve this matter to avoid any delays. You can reach me at maria.gonzalez@shop.es.",Incident
"Subject: Bericht über einen Fehler in der Datenaufbereitungsoberfläche

Sehr geehrte Kundenservice, ich wende mich an Sie, um einen Fehler in unserer Datenaufbereitungsoberfläche zu melden. Die Oberfläche ist während der Nacht nicht aktualisiert worden, aufgrund eines Synchronisierungsfehlers. Ich bin der Meinung, dass dies ein Problem mit dem Smartsheet-API sein könnte My name is [FULL_NAME].. Bislang habe ich versucht, Smartsheet neu zu starten und unsere Netzwerkverbindung zu überprüfen, aber das Problem behält sich bestehen. Ich würde mich freuen, wenn Sie mir helfen könnten, dieses Problem zu lösen. Bitte geben Sie mir Bescheid, falls Sie weitere Informationen benötigen. Vielen Dank für Ihr Verständnis und Ihre Unterstützung. Ich freue mich darauf, Ihre Rückmeldung zu erhalten. You can reach me at david.kim@corp.kr.",Problem
"Subject: Digital Strategies for Growth

Dear Customer Service, I am interested in exploring digital strategies that can aid in the growth of our brand You can reach me at [EMAIL].. I am particularly interested in understanding various digital channels and tools that can help our company promote itself and engage with customers. Could you please provide more information on digital marketing efforts, such as Social Media, E-Mail Marketing, and Search Engine Optimization (SEO)? I would greatly appreciate insights into how these strategies have contributed to market success. Thank you for your time. My name is [FULL_NAME].",Request
"Subject: Support Inquiry

Digital campaign analysis has stopped, need to update, brand growth tracking is affected You can reach me at [EMAIL].. Integration issues with various tools are to blame My name is [FULL_NAME].. API connections need to be checked, looking for software updates.",Incident
"Subject: System Requirements

I would like to know the system requirements for your project management SaaS platform to check compatibility.. My contact number is [PHONE_NUMBER].",Request
"Subject: Inquiry on System Requirements for Project Management SaaS

I am contacting you to seek details on the necessary system specifications for the optimal functioning of your project management software as a service. Could you furnish me with the minimum and recommended system configurations, including the processor speed, memory capacity, and the required operating system? This information is crucial for ensuring that our team's devices meet the requirements and can operate the software seamlessly.. My contact number is [PHONE_NUMBER].",Request
"Subject: Customer Support

Our marketing agency has encountered software malfunctions that are affecting our brand growth strategies. Recent system updates have been conflicting with our existing applications, leading to these issues You can reach me at [EMAIL].. Despite our efforts to troubleshoot by reinstalling the affected software and clearing caches, the problems continue. We need your assistance to resolve these issues and get our systems running smoothly again. My name is [FULL_NAME].",Incident
"Subject: Continuous Issues with Online Product Display

Facing difficulties with online product display during customer engagement. Campaign budget adjustments, keyword refinement, and improvements are needed.. My contact number is [PHONE_NUMBER].",Incident
"Subject: Verbesserung des Projekt-Managements mit Ubuntu 20.04 LTS und Redis 6.2

Sehr geehrte Kundenservice, ich schreibe in diesem Brief, um zu erkundigen, wie ich Ubuntu 20.04 LTS mit Redis 6.2 integrieren kann, um die Skalierbarkeit und Leistung des Projekt-Managements zu verbessern. Ich denke, dass diese Integration unser Team in der Lage setzen wird, größere Workloads zu verarbeiten und unseren Kunden bessere Dienstleistungen anzubieten. Könnten Sie mir bitte mehr Informationen dazu geben, wie ich diese Integration umsetzen kann? Ich würde jede von Ihnen bereitgestellte Ratgebersupport oder Ressourcen sehr schätzen You can reach me at [EMAIL]. Zusätzlich würde ich gerne wissen, ob es bestimmte Systemanforderungen oder potenzielle Herausforderungen gibt, die ich beachten sollte. Ich freue mich darauf, von Ihrer Unterstützung zu hören. Vielen Dank für Ihre Zeit und Ihre Hilfe. Ich freue mich darauf, von Ihnen bald zu hören. Mit freundlichen Grüßen, [Ihr Name] My name is [FULL_NAME].",Change
"Subject: Problem bei der medizinischen Scanner-Bearbeitung

Die medizinische Datenbearbeitung hat plötzlich ausgesetzt. Es könnte sein, dass der Scanner-Treiber überfällig ist My name is [FULL_NAME].. Nach dem Neustart des Scanners und der Aktualisierung des Treibers blieb das Problem bestehen. You can reach me at [EMAIL].",Incident
"Subject: Problem with Campaign Launch

Hello customer support, I am contacting you to report that my digital marketing campaigns have not been able to start My name is [FULL_NAME].. This may be because of an incompatibility with the Express.js version I am using. Despite attempting to restart my Mac Mini and updating McAfee, the issue remains. I would be grateful if you could examine this situation and offer a remedy at your earliest convenience You can reach me at [EMAIL].. Please inform me if you need further details from me to address this concern.",Incident
"Subject: Problem with Project Management Dashboard

There are occasional access problems with the project management dashboard. This might be related to recent server updates. I have cleared the cache and verified the user permissions, but the issue continues. We need your help to resolve this as soon as possible My name is [FULL_NAME].. We would greatly appreciate a quick response to this matter and are looking forward to your prompt attention You can reach me at [EMAIL].. Thank you.",Incident
"Subject: Django ElasticSearch HIPAA Compliance Issue

Ensure that the security protocols comply with HIPAA regulations.. My contact number is [PHONE_NUMBER].",Request
"Subject: Support Request: Medical Data Encryption Issue

Dear Customer Support, I am inquiring about a problem I encountered with the medical data encryption process. The encryption failed abruptly, and I suspect it might be a result of a software configuration error My name is [FULL_NAME].. Despite restarting the servers and updating the software, the issue remains unresolved. I would be highly grateful if you could offer any guidance to address this. Please inform me if there are specific actions I should undertake or if you need further information from me You can reach me at [EMAIL].. I am ready to supply any necessary details or engage in further discussion. Thanks for your assistance. Best regards, [Your Name]",Problem
"Subject: Security of Medical Data

Could you provide details on securing medical data using the Hub Smart-Thermometer products? Thank you.. My contact number is [PHONE_NUMBER].",Request
"Subject: Assistance Needed

Guidance Required for Integrating Microsoft SQL Server 2019 with SaaS Project Management Platforms?. My contact number is [PHONE_NUMBER].",Request
"Subject: Fehler in den Investment-Modellierungs-Ausgaben

Ein Missverständnis gibt es hier: Das Problem: Die Investment-Modellierungs-Ausgaben sind korrekt dargestellt, was zu ungenauen Prognosen führt. Warum es passieren könnte: Fehlende Daten oder veraltete Verfahren My name is [FULL_NAME].. Was bereits versucht wurde: Kubernetes wurde neu gestartet, die PostgreSQL-Verbindungen wurden geprüft, und Antiviren-Skannierungen wurden durchgeführt. You can reach me at [EMAIL].",Incident
"Subject: Request for Updating Product Details and Integration Options

Dear Customer Support, I am writing to request an update to the product details and integration options. The current process is causing inconvenience to customers, and we would like to request that the product details be updated to reflect the correct information. Additionally, we would appreciate if the integration options could be updated to include more flexible options for customers, as this would greatly improve the overall customer experience and reduce the number of returns and exchanges You can reach me at [EMAIL].. Thank you. My name is [FULL_NAME].",Change
"Subject: Benachrichtigung über unbefugten Zugriff auf Server

Die Benachrichtigung über einen unbefugten Zugriff wurde auf dem Server ausgelöst, der medizinische Daten verwaltet My name is [DOB].. Mögliche Ursache: schwache Firewallregeln und veraltete Software. Versuche, das System sicherer zu gestalten, umfassten eine Durchführung des Antivirus-Scans und das Updaten der Software You can reach me at [EMAIL]. Allerdings bestehen die Probleme nach wie vor.",Incident
"Subject: Unterstützung bei digitale Kampagnen

Aufgrund technischer Integrationsmängle konnten verschiedene Tools und Plattformen für die Ausführung der digitalen Kampagnen nicht verwendet werden. Die Wiederherstellung der Server, die Überprüfung der API-Verbindungen und die Aktualisierung der Software haben die Probleme nicht gelöst My name is [FULL_NAME].. Diese Misserfolge haben die Wachstumsrate der Marke erheblich beeinträchtigt. You can reach me at [EMAIL].",Incident
"Subject: Assistance Required

Our medical data security system is facing vulnerabilities, possibly due to outdated software without proper encryption You can reach me at [EMAIL].. Despite attempts to secure the system by updating applications and implementing firewall rules, the issues continue. Urgent assistance is needed to resolve this issue as soon as possible. My name is [FULL_NAME].",Problem
"Subject: Data Breach Incident

We have encountered a significant data breach impacting our medical data systems You can reach me at [EMAIL].. This may have occurred due to outdated security protocols. We have attempted to implement immediate patches and security updates across the affected products, but the issue persists My name is [FULL_NAME].. We require urgent assistance to resolve the matter and prevent further breaches.",Problem
"Subject: Frage zur Anpassbaren Digitalen Strategie-Dienstleistung

Ich möchte mehr über Ihre digitalen Strategie-Dienstleistungen erfahren und erfahren, wie sie die Markenwachstumsstrategie beeinflussen können You can reach me at [EMAIL]. Könnten Sie bitte mehr Details zu den angebotenen Dienstleistungen geben, z.B My name is [FULL_NAME].. Sozialmedien-Management, Inhaltsanfertigung und Suchmaschinenoptimierung? Es wäre toll, wenn Sie einige Fallstudien oder Erfolgsgeschichten von früheren Kunden teilen könnten. Darüber hinaus interessiere ich mich für die Expertise und Erfahrung Ihres Teams in diesem Bereich. Ich suche nach einer umfassenden digitalen Strategie, die das volle Potenzial meiner Marke voll ausnutzen kann. Ich freue mich auf Ihre Rückmeldung und bin bereit, einen Anruf zu vereinbaren, um meine spezifischen Bedürfnisse zu besprechen.",Request
"Subject: Investment Data Analytics Platform Crash

The investment data analytics platform unexpectedly halted because of inadequate system resources or software conflicts. After restarting the systems and reviewing for available updates, the issue remains unresolved.. My contact number is [PHONE_NUMBER].",Problem
"Subject: Boost Data Analytics Support

Requesting an enhancement in our data analytics capabilities You can reach me at [EMAIL].. We are aiming to optimize our investment strategies using the appropriate software and hardware tools to improve our data-driven decision-making and stay ahead of the competition. We believe that the right tools can support us in achieving our goal and driving business growth My name is [FULL_NAME].. I would greatly appreciate your guidance and recommendations on the tools to use. Thank you for your time and assistance.",Change
"Subject: Request for Updated Hardware and Software Compatibility

Dear Customer Support Team, I am contacting you to inquire about the integration of new hardware and software compatibility to enhance our project management experience. As a valued customer, I believe it is crucial to adopt the latest technologies in order to achieve efficient and effective project management. The current system has some limitations, and I am requesting an update to include the latest hardware and software compatibility, which would facilitate better project management. Could you please share with me the current status of this integration and provide an estimated timeline for its implementation? Furthermore, are there any plans to introduce new features or updates that would further improve the project management experience? I would be grateful if you could provide me with more information on these matters You can reach me at omar.hassan@secure.net.. Thank you for your time and assistance. I am looking forward to hearing back from you soon. Please notify me if you need any additional information from me. My name is [FULL_NAME].",Change
"Subject: 

Dear Customer Support, I am in need of your assistance as I have encountered a data breach through an insecure network. The root cause is due to insufficient encryption and out-of-date firmware. Despite my efforts to address the issue by restarting the router and reviewing the firewall settings, the problem continues to persist. I would greatly appreciate your help in securing my network and preventing future breaches You can reach me at [EMAIL].. Could you kindly offer guidance on how to update the firmware and enhance encryption? Additionally, I would be grateful for any supplementary advice to strengthen the security of my network My name is [FULL_NAME].. Thank you for your attention and assistance. I eagerly await your response. Sincerely, [Your Name]",Problem
"Subject: Security Measures for Medical Data in Hospital Infrastructure

Could you provide detailed solutions for securing medical data within our hospital's infrastructure?. My contact number is [PHONE_NUMBER].",Request
"Subject: Aktualisierung der Datenbank-Clusterverwaltungskonfiguration

Aktualisieren Sie die Datenbank-Clusterverwaltungskonfiguration, um die Leistung und Zuverlässigkeit für die Projektmanagement-Softwareas-a-Service-Plattform zu verbessern.. My contact number is [PHONE_NUMBER].",Change
"Subject: Frage zum Einsatz von Elasticsearch in Xero und Microsoft-Produkten

Sehr geehrte Kundensupport, ich schreibe hier, um zu erfahren, welche Zahlungsweisen für die Elasticsearch-Integration in Xero und Microsoft-Produkte zur Verfügung stehen. Könnten Sie mir dieselben Informationen zum Preispläne und eventuellen Rabatten wie möglichst schnell liefern? Es wäre mir auch wertvoll, wenn Sie mir die Prozedur und die Kosten für die Zahlungserledigung erklären und savoir si des frais supplémentaires sont associés à l'intégration My name is [FULL_NAME].. De plus, je suis curieux de savoir si il y a des limites ou des restrictions concernant le nombre d'utilisateurs ou les données à intégrer You can reach me at [EMAIL].. Je suis en train de préparer mon entreprise pour l'utilisation d'Elasticsearch avec Xero et Microsoft-Produits, et je veux être sûr de prendre en compte tous les coûts engagés. Merci beaucoup pour votre temps et votre aide. J'attends votre retour avec impatience. Cordialement, [Veuillez remplacer par votre nom]",Request
"Subject: Support for Security Concern

A healthcare organization faced an unauthorized breach of medical data, which may be attributed to weak security measures You can reach me at [EMAIL].. They have already implemented firewall enhancements and antivirus scans, but the issue continues. Assistance is required to identify the root cause and to implement a solution to prevent future occurrences. My name is [FULL_NAME].",Problem
"Subject: Verfügbare Integrationsoptionen für QuickBooks Online

Kontaktieren Sie uns, um Informationen über die verfügbaren Integrationsoptionen für QuickBooks Online und unser SaaS-Projektmanagement-Tool zu erhalten. Bitte geben Sie uns Details zu den verfügbaren Integrationen an, z.B. API-Verbindungen und Drittanbieter-Connector. Wir schätzen Ihre bereitgestellten Informationen zum Thema und empfehlen Ihnen, die Website zu besuchen oder uns auf [PHONE_NUMBER] My name is [FULL_NAME].. <tel_num> für weitere Unterstützung zu kontaktieren You can reach me at [EMAIL]. Wir freuen uns darauf, die verfügbaren Optionen sowie eventuelle Einschränkungen in einer detaillierteren Diskussion vorzustellen.",Request
"Subject: Identifying Issues with Campaign Engagement

Customer Support, <br>Our campaign metrics for Lynda.com Spiegellose Kamera indicate a notable drop in engagement. <br>Potential causes may include recent algorithm changes or ineffective targeting strategies. <br>We have made adjustments to ad spend and audience demographics, which have shown some improvement My name is [FULL_NAME].. <br>We would greatly appreciate your assistance in identifying the root cause of the issue and providing guidance to optimize our campaigns for better performance You can reach me at [EMAIL].. <br>Please let us know if you need any additional information.",Incident
"Subject: Support for Project Management SaaS Application Issues

Our project management SaaS application is encountering functionality problems across multiple devices. It appears recent updates or integration conflicts might be the cause. We have already tried clearing the cache, reinstalling the application, and checking for updates, but the issue still persists My name is [DOB].. We need assistance to resolve this problem. You can reach me at [EMAIL].",Incident
"Subject: Update project software dashboard

Optimize the layout of the project management software dashboard for a better user experience and easier navigation. The revised design will facilitate quicker access to project tools.. My contact number is [PHONE_NUMBER].",Change
"Subject: Securing Medical Data on a WordPress Healthcare Site

We are reaching out for guidance on securing medical data within a WordPress healthcare site. Our healthcare organization needs to ensure that our website is compliant with relevant regulations as we handle sensitive patient information You can reach me at [EMAIL].. Could you provide us with recommendations for plugins, themes, and security practices to secure our WordPress site? We would greatly appreciate advice on data encryption, access controls, and backup procedures My name is [FULL_NAME].. Additionally, we are interested in understanding specific WordPress features that can help maintain the confidentiality of patient data.",Request
"Subject: Report on System Outage: Impact on Medical Data Security

A system outage is impacting medical data security and hospital operations. The cause is unknown, but a recent software update or network failure is suspected My name is [FULL_NAME].. The team has restarted affected systems and reached out to vendors for assistance. You can reach me at [EMAIL].",Incident
"Subject: Jenkins Data Analytics Inquiry

I am contacting you to request information on data analytics tools that can be integrated with Jenkins for the purpose of investment optimization You can reach me at [EMAIL].. I would be very grateful for any details or suggestions you could provide. Particularly, I am interested in tools that can assist me with the analysis and optimization of my investments My name is [FULL_NAME].. Thank you for your time and help.",Request
"Subject: Request for DataRobot Integration

Dear Customer Support Team, I am writing to inquire about the DataRobot SaaS Project Management Operating System integration My name is [FULL_NAME].. I am interested in leveraging DataRobot's capabilities to enhance project management functionalities You can reach me at [EMAIL].. Could you please provide more information on the integration process, including necessary documentation, APIs, and developer resources? Additionally, it would be helpful if you could give advice on potential challenges that may arise during the integration process and provide information on the benefits of integrating the DataRobot operating system to improve project management workflows.",Request
"Subject: Invoicing Discrepancy Inquiry

I am contacting you to address a recent billing irregularity. I was overbilled for goods I did not request You can reach me at [EMAIL].. I believe this could be a result of a misconfigured account. I had previously reached out for assistance, but have not received a resolution My name is [FULL_NAME].. I kindly ask that you investigate and resolve this matter promptly. Please inform me if more details are needed from my side. I await your response.",Problem
"Subject: Sicherheit

Kontaktieren Sie anlässlich der Anfrage bezüglich Sicherheitsmaßnahmen und IT-Lösungen für Gesundheitsdienstleister. Können Sie Informationen über Art und Weise geben, wie Vertraulichkeit, Integrität und Verfugbarkeit medizinischer Daten gewährleistet werden? Protokolle und Datenverstärkungen zur Abfängen cyberbasierten Bedrohungen? Ich freue mich auf jegliche Informationen, die Sie zur Angelegenheit bereitstellen können.. My contact number is [PHONE_NUMBER].",Request
"Subject: 

Assistance needed for data breach in hospital systems. My contact number is [PHONE_NUMBER].",Incident
"Subject: Integration von ESET NOD32

Suchen Sie praxisorientierte Anweisungen zur Integrierung des ESET NOD32 Antiviruses in einen projektmanagement-basierten SaaS-Service und verstärkten Sicherheitsmaßnahmen? Prüfen Sie gerne detaillierte Anleitungen in der Kenntnisbank-Artikel-Auswahl. Bei Bedarf können relevante Dokumente und Ressourcen zur Verfügung gestellt werden, um den Integrationsprozess zu erleichtern.. My contact number is [PHONE_NUMBER].",Request
"Subject: Rechnungsfehler

Sehr geehrte Kundenservice, wir haben einen Rechnungsfehler festgestellt und möchten sicherstellen, dass Ihr Konto korrekt abgerechnet wird. Es könnte aufgrund neuester Softwareupgrades passiert sein. Wir haben die Zahlungsinformationen überprüft und versucht, das Problem durch Anpassung der Kontoeinstellungen zu lösen. Allerdings besteht weiterhin ein Problem. Wenn Sie uns bei der Suche nach einer Lösung unterstützen, würden wir uns sehr freuen You can reach me at [EMAIL].. Könnten Sie bitte den Fall näher einordnen und eine schnelle Lösung bereitstellen? Dankeschön für Ihr Verständnis und Ihre Unterstützung bei der Verhinderung zukünftiger Fehler My name is [FULL_NAME].. Wir hoffen, dass Sie uns bald weitere Informationen zur Verfügung stellen können, um das Problem zu lösen.",Problem
