email,type
"Subject: Unvorhergesehener Absturz der Datenanalyse-Plattform

Die Datenanalyse-Plattform brach unerwartet ab, da die Speicheroberfläche zu gering war My name is [FULL_NAME].. Ich habe versucht, Laravel 8 und meinen MacBook Pro neu zu starten, aber das Problem behält sich bei. Ich benötige Ihre Unterstützung, um diesen Fehler zu beheben. You can reach me at [EMAIL].",Incident
"Subject: Customer Support Inquiry

Seeking information on digital strategies that can aid in brand growth and details on the available services. Looking forward to learning more to help our business grow My name is [FULL_NAME].. Thank you, and I look forward to hearing from you soon. You can reach me at [EMAIL].",Request
"Subject: Data Analytics for Investment

I am contacting you to request information on data analytics tools that can be utilized with the Eclipse IDE for enhancing investment optimization. I am seeking suggestions for tools that can aid in making data-driven decisions. Particularly, I am interested in tools that can manage large datasets and offer advanced analytics features. These tools should be compatible with the Eclipse IDE and can smoothly integrate into my workflow You can reach me at [EMAIL]. Key features I am interested in include data visualization, predictive modeling, and machine learning capabilities. I would greatly appreciate any recommendations or advice on how to begin with data analytics for investment optimization using the Eclipse IDE. My name is [FULL_NAME].",Request
"Subject: Krankenhaus-Dienstleistung-Problem

Ein Medien-Daten-Sperrverhalten trat aufgrund unerlaubten Zugriffes auf You can reach me at [EMAIL].. Eine schwache Passwortauswahl ist wahrscheinlich die Ursache My name is [FULL_NAME].. Nach dem Versuch, das Passwort zu ändern, behält das Problem leider anhaltend Bestand.",Incident
"Subject: Security

Dear Customer Support, I am reaching out to inquire about the security protocols you have in place to protect medical data. As a valued customer, I want to ensure that my sensitive health information is handled with the utmost care and confidentiality My name is [FULL_NAME].. Could you please provide me with information on the measures you take to safeguard medical data? Additionally, I would appreciate it if you could inform me about any certifications or compliances your company adheres to, such as HIPAA You can reach me at [EMAIL].. I am also keen to know if you have any specific measures to prevent data breaches and unauthorized access. Thank you for your time and assistance. I look forward to your prompt response.",Request
"Subject: Concerns About Securing Medical Data on 2-in-1 Convertible Laptop with Norton 360

Inquiring about best practices for securing medical data on a 2-in-1 Convertible Laptop. Currently have Norton 360 installed and need guidance on how to properly configure it to protect sensitive medical information You can reach me at [EMAIL].. Would greatly appreciate any tips or recommendations you can offer. My name is [FULL_NAME].",Request
"Subject: Ratung für Sicherung medizinischer Daten in HubSpot CRM PostgreSQL-Umgebungen

Ratung, ob es möglich ist, Sicherung medizinischer Daten in HubSpot CRM PostgreSQL-Umgebungen durchzuführen? Danke.. My contact number is [PHONE_NUMBER].",Request
"Subject: Problem with Integration

The integration stopped working unexpectedly, causing synchronization errors between our platforms My name is [FULL_NAME].. This might be due to recent modifications to the API. Despite attempting to restart services and examining logs, the problem remains unresolved You can reach me at [EMAIL].. I would be grateful for your help in addressing this issue.",Problem
"Subject: Assistance Request

Dear Customer Support, I am writing in regards to a recently detected data blocker in our medical data sets. This issue might stem from outdated PHP versions My name is [DOB].. Despite updating the Elasticsearch and Terraform configurations, the problem persists. I would appreciate any assistance you can provide at your earliest convenience to resolve this matter. Kindly inform me of any additional information you require to continue the investigation and resolution. I look forward to hearing from you soon. Thank you for your time and support. Kind regards, [Your Name] You can reach me at maria.gonzalez@shop.es.",Problem
"Subject: Support Request

The latest data analysis reports are inconsistent. Potential causes might be input errors due to recent software updates. Please check the input data and re-run the analysis You can reach me at [EMAIL]. The issue persists. My name is [FULL_NAME].",Problem
"Subject: Issue with Data Analytics Platform - Insufficient RAM Allocation

I am reaching out to report an issue with our data analytics platform. The platform has crashed, and we believe it might be due to inadequate RAM allocation My name is [FULL_NAME].. We have already tried restarting the server and reviewing the logs, but the problem still exists You can reach me at [EMAIL].. We kindly request your assistance in investigating this matter and providing a resolution at your earliest convenience. Please inform us if any additional information from our side is necessary to address this issue. The platform is currently unavailable, and we urgently need it to be operational. Thank you for your consideration and support.",Problem
"Subject: Reported Issue with Project Sync Resulting in Data Loss

Dear Customer Support,\n\nI am reporting an issue with our project sync, which has led to data loss. This sync failure occurred after recent software updates, possibly due to incompatibility issues My name is [FULL_NAME].. Despite restarting our systems and reviewing firewall settings, the problem remains unresolved.\n\nThe software updates were installed recently, and the sync failure happened shortly thereafter. Our team has attempted to troubleshoot the issue by restarting the systems and reviewing the firewall settings, but these efforts have been unsuccessful.\n\nI would greatly appreciate it if you could investigate this matter and provide a solution to resolve the sync issue and recover the lost data You can reach me at [EMAIL].. If there is any additional information or logs you require from our side, please let me know.\n\nThank you for your time and assistance.\n\nBest regards,\n[Your Name]",Incident
"Subject: Strategies for Brand Expansion

Hello Customer Support Team, I am writing to seek advice on digital methods that can aid in expanding my brand. In the current digital era, a robust online footprint is essential for business success You can reach me at [EMAIL].. I am keen to learn about the strategies you suggest for boosting brand visibility and attracting more customers. Particularly, I am interested in exploring social media marketing, search engine optimization, and content development My name is [FULL_NAME].. I think applying the appropriate digital strategies could significantly advance my brand. Would you be able to offer some insights on this? I look forward to your response. Thanks for your time and support.",Request
"Subject: Issue with Website Analytics Dashboard

Dear Customer Support, I am encountering a problem with my website analytics dashboard that is not updating You can reach me at [EMAIL].. I believe there might be an issue with the API connection. I have already restarted the dashboard and verified my credentials, yet the problem still exists. Could you please investigate and offer a solution at your earliest convenience? If you require any additional information from me, please let me know My name is [FULL_NAME].. Thank you for your assistance, and I look forward to your response.",Incident
"Subject: Urgent: Data Breach Identified in Hospital Network

Data breach found, assistance required. My contact number is [PHONE_NUMBER].",Incident
"Subject: Request for Assistance with Data Integration

We are encountering data integration problems while optimizing investments using analytics tools. These issues might be due to unexpected software compatibility problems between various applications. Despite updating the software and checking for configuration errors, the problem continues My name is [FULL_NAME].. We would greatly appreciate your guidance in resolving this matter to ensure a smooth data flow and accurate analysis You can reach me at [EMAIL].. Please inform us of the next steps to address this issue.",Problem
"Subject: Request for Updating Integration Features on Mobile

I am writing to request an update to the integration features in our mobile applications You can reach me at [EMAIL].. The current features are outdated and not compatible with recent software versions. I would like to request enhancements to ensure seamless functionality with the latest software versions. My name is [FULL_NAME].",Change
"Subject: Problem with Data Analytics Software Frequent Crashes

The data analytics software used by the financial firm is experiencing frequent crashes, likely due to RAM limitations and software conflicts.. My contact number is [PHONE_NUMBER].",Problem
"Subject: Urgent: Identification of a Data Breach within the Patient Records System

Breach in data identified. My contact number is [PHONE_NUMBER].",Incident
"Subject: 

To Whom It May Concern, I am contacting you to report a possible data breach, which may be related to outdated software You can reach me at [EMAIL]. Despite my attempts to update various programs, including Snagit, Ansible, and Firebase, the problem continues. I am worried about the security of my data and would appreciate your help in addressing this issue promptly. Could you advise on the next steps or suggest a solution to prevent future breaches? I value your swift response to this matter and eagerly await your guidance. Please inform me if you require any further information to assist me. I can be reached at your convenience to discuss this further. Thank you for your support in resolving this issue. Please provide any necessary reference number <ref_num> for my records, and I look forward to your prompt follow-up. My name is [FULL_NAME].",Incident
"Subject: Notwendige Technische Unterstützung

Sehr geehrte Kundensupport, wir begegnen momentan unregelmäßigen Ladezeiten bei unserer Projektmanagement-Plattform. Möglicherweise ist dies auf erhöhte Nutzungsdaten zurückzuführen My name is [FULL_NAME].. Wir haben bereits den Cache geleert, die Serverleistung überprüft und die Anwendungsdiener neu gestartet. Trotz unserer Anstrengungen besteht das Problem weiterhin. Wir schätzen Ihre Unterstützung, um bald eine Lösung anzubieten You can reach me at [EMAIL].. Bitte geben Sie uns, falls nötig, weitere Informationen zur Verfügung, um das Problem zu lösen.",Problem
"Subject: Urgent: Update Encryption Protocols for JIRA and HubSpot CRM Systems

Hello customer support, I am contacting you to highlight the urgent requirement to enhance encryption protocols on our JIRA and HubSpot CRM systems in order to secure medical data effectively You can reach me at [EMAIL].. This update is vital for safeguarding sensitive information and ensuring adherence to regulatory standards. Could you please undertake these updates as soon as possible and notify me upon completion? If you need any more details from me, please let me know. My name is [FULL_NAME].",Change
"Subject: Guidelines for Securing Medical Data on macOS Systems with Symantec Endpoint Protection

Could you provide guidelines on securing medical data on macOS systems using Symantec Endpoint Protection? Thank you for your assistance.. My contact number is [PHONE_NUMBER].",Request
"Subject: Problem with Software Update

Data analytics functions are disrupted following the latest software update. Efforts to restart and reinstall the software have been unsuccessful.. My contact number is [PHONE_NUMBER].",Incident
"Subject: Slowness observed in the data analytics platform

There has been a noticeable slowdown in the data analytics platform My name is [FULL_NAME].. It might be due to inadequate server resources You can reach me at [EMAIL].. Despite restarting the servers and verifying the configurations, the problem continues.",Incident
"Subject: Verlust medizinischer Daten gemeldet

Unverschlüsselte medizinische Daten auf ungeschützten Geräten wurden durch alte Software übernommen. Versuche, die Systems neu zu starten und Virenscans durchzuführen, wurden unternommen.. My contact number is [PHONE_NUMBER].",Incident
"Subject: Best Practices for Securing Medical Data with Snagit and KNIME

I am contacting you to seek advice on the secure management of medical data when utilizing Snagit and KNIME. Given the sensitive nature of the data, I am keen to adhere to all necessary security protocols. Could you offer guidance on the secure storage and transmission of medical images and data through these tools? Additionally, I would be grateful for any suggestions on encryption, access control, and compliance with applicable regulations. I appreciate your consideration and anticipation of your prompt response My name is [FULL_NAME].. I am eager to hear from you soon. You can reach me at [EMAIL].",Request
"Subject: Guidance on Optimizing Investment Strategies Using Data Analytics

Dear Customer Support, I am writing to request assistance in optimizing my investment strategies through the use of data analytics. The abundance of data available can be daunting, and I believe data analytics tools can aid in making more precise forecasts and maximizing returns. However, I need guidance on how to effectively use these tools My name is [FULL_NAME].. Could you provide me with some pointers on getting started? It would be greatly appreciated if you could recommend the most suitable data analytics tools for investment analysis, as well as offer tips on how to interpret the data and make informed decisions You can reach me at [EMAIL].. Additionally, I would like to know if you have any resources or tutorials available that can help me learn more about data analytics and its application in investment strategies. I am very eager to learn more about this topic and appreciate your assistance in this matter. I look forward to your response. Best regards, [Your Name]",Request
"Subject: Requirements for Wave Integration with Outlook 2021

I am contacting you to seek information regarding the prerequisites for integrating Wave with Outlook 2021 My name is [FULL_NAME].. Could you kindly furnish me with the essential details, including the minimum system specifications such as the operating system, processor speed, and memory capacity, to ensure a seamless integration process? Furthermore, are there any specific software or plugin prerequisites that need to be met? Additionally, it would be greatly appreciated if you could share any troubleshooting advice or typical issues that might occur during the integration You can reach me at [FULL_NAME]@corp.kr.. I am eagerly looking forward to your response and resolving this matter. Thank you for your time and support.",Request
"Subject: Issue Regarding Encryption

Dear Customer Support, I am writing to report a problem with our medical data encryption My name is [DOB].. This issue has appeared suddenly and might be related to a software update issue You can reach me at [EMAIL].. We have already tried restarting the servers and checking the configurations, but the problem persists. The malfunction occurred without prior warning and we are concerned about the security of our data. We would greatly appreciate it if you could investigate this further and provide a solution as soon as possible. Please let us know if you require any additional information from us to resolve this issue.",Problem
"Subject: Problem with Invoice

I am encountering a problem with my invoice You can reach me at [EMAIL]. The amount shown online is not accurate. I have attempted to resolve this by refreshing the page and signing out then back in, but the issue still exists. I believe it might be a technical error or a data synchronization issue. Can you please investigate this for me and give me a corrected invoice total? My name is [FULL_NAME].",Incident
"Subject: Anfrage für technischen Support

Es gibt plötzliche Verbindungsstörungen auf mehreren Plattformen und Geräten. Ich habe versucht, die Geräte neu zu starten und die Netzwerkeinstellungen zu überprüfen, aber das Problem tritt immer noch auf.. My contact number is [PHONE_NUMBER].",Incident
"Subject: Enquiries on Shopware Integrations with Google Cloud and Microsoft Azure

Hello Customer Support, I am writing to inquire about the integrations that are currently available for Shopware with Google Cloud Platform and Microsoft Azure services My name is [DOB].. I am currently using Shopware as my e-commerce platform and I am keen to explore the integration opportunities with Google Cloud Platform and Microsoft Azure services. Would you be able to provide me with a detailed list of the available integrations and their descriptions? Furthermore, I would be grateful for any assistance in understanding how to set up and configure these integrations. Specifically, I am interested in knowing more about the integration with Google Cloud Storage, Google Cloud Functions, and Microsoft Azure Storage. Could you also inform me about any future plans for new integrations? Lastly, I would appreciate any insights into the limitations or restrictions on the use of these integrations. I look forward to your response and hope to receive detailed guidance on this matter. Thank you for your time and support. Kind regards, [Your Name] You can reach me at [EMAIL].",Request
"Subject: Enhancing Security for Medical Data Transmission Systems

Hello Customer Support, I am writing to inquire about enhancing security for the transmission and storage of medical data. Given the sensitive nature of medical information, it is crucial that it is protected with the highest level of security to safeguard patient details My name is [FULL_NAME].. Could you please share the current encryption methods used by your organization and the steps taken to ensure the secure handling of medical data? Additionally, are there plans to introduce further security enhancements, such as multi-factor authentication and encryption key management? Your insights on this matter would be greatly appreciated. Thank you for your time and cooperation You can reach me at [FULL_NAME]@corp.kr.. I eagerly await your response.",Change
"Subject: Expansion of Digital Brand

Customer support, reaching out for inquiries about digital strategy services to aid in brand growth My name is [DOB].. Would appreciate detailed information and pricing for the services offered You can reach me at [EMAIL].. Thank you for your assistance, and I look forward to hearing back soon.",Request
"Subject: Support for Data Analytics Platform Crash

The data analytics platform encountered issues while processing client investment reports due to high server load and software conflicts, despite restarting applications and checking for updates. The problem continues and requires your assistance.. My contact number is [PHONE_NUMBER].",Incident
"Subject: Tech Support Inquiry

I am contacting you to ask about the integration possibilities for ClickUp within my existing technology infrastructure. Could you send me a detailed list of tools that are compatible with ClickUp and a short explanation of their integration features? Additionally, I would be grateful for any instructions on setting up these integrations and any supplementary materials you can provide.. My contact number is [PHONE_NUMBER].",Request
"Subject: Problems with SaaS-Tools Integration

System downtime affecting JIRA and Google Meet. Restarting services and clearing caches resolved the issue.. My contact number is [PHONE_NUMBER].",Incident
"Subject: Support for Expanding a Brand

Seeking information on digital marketing tactics for brand growth. Please provide specifics on the services you offer.. My contact number is [PHONE_NUMBER].",Request
"Subject: Update Integration Settings for Compatibility

Customer support, requesting an update to the integration settings for various software tools to enhance compatibility with our scalable SaaS platform. The current settings, although optimized, are causing issues with data synchronization My name is [FULL_NAME].. I would greatly appreciate your assistance in updating these settings as soon as possible. Please let me know the necessary information so we can proceed. You can reach me at [EMAIL].",Change
"Subject: Notwendige technische Unterstützung

Viele Werkzeuge funktionierten zeitgleich aus, verursacht durch einen Netzwerkausfall.. My contact number is [PHONE_NUMBER].",Problem
"Subject: Digital Campaign Synchronization Problem Noted

Hello Customer Support, <br>A digital campaign synchronization issue has been observed by me and I am reporting it here. <br>The issue surfaced after the recent software updates and configuration alterations My name is [FULL_NAME].. <br>Steps taken to troubleshoot include restarting the devices and verifying internet connectivity, but unfortunately, the issue still exists. <br>I kindly request you to examine the situation and offer a resolution at the earliest. <br>Please inform me if you need any further details from me for the resolution. <br>I am eagerly awaiting your response. <br>Thanks a lot for your attention and help You can reach me at david.kim@corp.kr.. <br>Best regards, [Your Name]",Incident
"Subject: 

During the last deployment, users encountered notable performance issues with the application. This might be due to unoptimized code introduced in the latest update. We have already restarted the servers and rolled back the update, but the problems continue You can reach me at [EMAIL].. The team is currently actively investigating the cause and working on a solution to restore optimal performance. My name is [FULL_NAME].",Problem
"Subject: Support Needed

Customer Support, facing issues with unauthorized access attempts to medical data in my report. The problems might be due to outdated security protocols. Despite efforts to enhance encryption and update system settings, these measures have been unsuccessful. I would greatly appreciate some guidance to resolve the issue and prevent similar occurrences in the future You can reach me at [EMAIL]. Please let me know the next steps to take. Thank you for your assistance, and I look forward to hearing from you soon. My name is [FULL_NAME].",Problem
"Subject: Support Request for Data Breach Issue

There has been an unexpected data breach that may have compromised sensitive medical data. This is likely due to insufficient security measures and outdated software You can reach me at [EMAIL].. Actions taken include securing the system, updating passwords, and monitoring network activity. Assistance is needed to ensure the necessary steps are taken to protect sensitive information and prevent future breaches. My name is [DOB].",Incident
"Subject: Support Inquiry for Invoice Management

Please contact us to obtain details about the invoice management options in our software, including subscription renewal services. Would you like more information on various pricing models and plans? I look forward to providing details on available discounts and promotions, including potential discounts for long-term contracts or bulk purchases. Additionally, I would be happy to discuss our security measures and the methods we use to protect customer data My name is [FULL_NAME].. Thank you for your patience and I look forward to your response soon. You can reach me at david.kim@corp.kr.",Request
"Subject: Support for Digital Marketing

Request for enhancements in digital marketing tools integration to optimize software performance. Aim is to enable effective brand growth strategies and improve the overall customer experience My name is [FULL_NAME].. Appreciate if could look into this matter and provide a solution as soon as possible. Thank you for your time and assistance. You can reach me at [EMAIL].",Change
"Subject: Technische Probleme

Die Data-Analytics-Plattform funktioniert nicht richtig und es werden unkorrekte Investment-Analyse-Fehlermeldungen generiert. Dies könnte auf einen Software-Fehler hindeuten.. My contact number is [PHONE_NUMBER].",Incident
"Subject: Medical Support

I am reaching out to inquire about solutions that can secure medical data and enhance hospital infrastructure My name is [DOB].. Could you provide details on the services you offer, including data encryption and network security? I would greatly appreciate any information that could help improve the overall efficiency of hospital operations You can reach me at [EMAIL].. Thank you for your time and assistance. I look forward to hearing from you soon.",Request
"Subject: Aid for Issues with Website Performance

Dear Customer Support, the performance of the agency websites has significantly slowed down, causing delays in campaign management. Despite clearing caches and optimizing images, the issues persist You can reach me at [EMAIL].. I suspect that this might be due to increased traffic or underlying infrastructure problems. Could you please investigate and offer a solution to improve website performance? My name is [FULL_NAME].",Incident
"Subject: Technical Help

The scanner is not functioning correctly because of old drivers and recent macOS updates. Despite efforts to restart, update software, and reinstall drivers, the problem remains unresolved.. My contact number is [PHONE_NUMBER].",Incident
"Subject: Problem with SQL Server Downtime

Faced an SQL Server outage that disrupted data analytics processing, impacting investment optimization You can reach me at [EMAIL].. The outage might be due to high query loads on the server My name is [FULL_NAME].. Restarted the SQL Service and reviewed the server logs for any errors.",Incident
